quesId	Q_Id	prompt.content.Chokri-Latin.text.000000.startindex	prompt.content.Chokri-Latin.text.000000.endindex	prompt.content.Chokri-Latin.text.000000.textspan.Latin	prompt.content.Chokri-Latin.audio.fileId	prompt.content.Chokri-Latin.audio.filename	prompt.content.Chokri-Latin.audio.textGrid.sentence.000000.startindex	prompt.content.Chokri-Latin.audio.textGrid.sentence.000000.endindex	prompt.content.Chokri-Latin.audio.textGrid.sentence.000000.transcription.Latin
Q20221127180629697798	HLT_18								Covid 19 bazü ce dibi zü nha daru sü mü kra yo?
Q20221127180629698199	HLT_19								n hu(teeth) thi zü ce dibi zü nha daru sü yo?
Q20221127180629698586	HLT_20								nha daru di bi zü ko sü uhu(teeth) küthi kükre kükre zü(decay,gum disease,sensitivity etc) ko la?
Q20221127180629698975	HLT_21								neko rüna lo thuma mi pe yo zü(kobiraz) mi bayo ma? Püko dipü bizü thi no mi pe yo?
Q20221127180629699346	SPR_1								Polo hi dibi no shüdu vori ?
Q20221127180629699818	SPR_2								neko rüna lo thazü dipü bizü rüzü merü thino vori?
Q20221127180629700451	SPR_3								rugby bizü rüzü kropu bame neko rüna lo?
Q20221127180629701118	SPR_4								Dibi no rüzü hi u mo sürho thi bayo?
Q20221127180629702508	SPR_5								No dibi zü rüzü ko rüzü yo? Dibi no rüzü yo?
Q20221127180629703388	SPR_6								n natsi ce no di rüzü rüzü yo? No thazü rüzü zü bayo thuju kropü posüte?
Q20221127180629705037	SPR_7								celü rüzü mu ceta rüzü küve posüte?
Q20221127180629705855	SPR_8								wrestling bizü rüzü za posüte? Süno süko sü rüzü yo?
Q20221127180629706359	SPR_9								board games rüzü za posüte? Ba mütha u za ko mü dipübi no rüzü yo?
Q20221127180629706935	SPR_10								marble(guti) sü no rüzü yo ma? di bizü rüzü rüzü yo? dibi no rüzü yo?
Q20221127180629707471	SPR_11								kütsü sü no dipü bizü rüzü rüzüyo? dibi no rüzü yo?
Q20221127180629708004	SPR_12								rüzü pü ri küra müle zü ko mori thayese müle zü ko bayo ma?
Q20221127180629708459	SPR_13								sü(stick) sü no rüzü pü ri bayo ma? Dibi no rüzü yo?
Q20221127180629708915	SPR_14								celü lo rüzü za rüzü pü ri n rüna lo bayo ma? Dibi no rüzü yo?
Q20221127180629709374	SPR_15								rü pü no rüzü zü za rüzü pü ri bayo ma? Ütü mü dibi no rüzü yo?
Q20221127180629709859	SPR_16								yoga hi pü kümüve diwa?
Q20221127180629710316	CLT_1								n rüna krüta ko dipü matho ko thi no rüna peyo?
Q20221127180629710778	CLT_2								thüma dibi zü ko vo rüna krüta thiyo? mü püko di pü thi ba yo?
Q20221127180629711201	CLT_3								Rüna za development committee hi di thiyo?
Q20221127180629711572	CLT_4								n rüna mi dibi no u külhu mu u ujo dibi no lhüyo?
Q20221127180629711942	CLT_5								Customary court hi n rüna lo dibi no ujo ko thiyo?
Q20221127180629712303	CLT_6								Customary court hi sopü bizü mi wo süyo? Pü di pü bizü thiyo?
Q20221127180629712620	CLT_7								n rüna mi ko za füne ju ko kropü posüte?
Q20221127180629712933	CLT_8								uma kürü tho fü(shawl) za ulhu dibi yo?
Q20221127180629713313	CLT_9								n rüna mi za bepa,ti, si bizü ko didi süyo?
Q20221127180629713696	CLT_10								n rüna mi ko di matho thi mükroyo?
Q20221127180629714152	CLT_11								n rüna mi ko di ti yo?
Q20221127180629714543	CLT_12								n rüna mi ko di ti mükro yo?
Q20221127180629714930	CLT_13								dibi no talhako hi teyo n rünami ko?
Q20221127180629715344	CLT_14								n rünami ko lhako te ze la thenye kro-o thi yo me? Dibi no thenye hi thiyo?
Q20221127180629715760	CLT_15								thenye dipü no kümele tho? Dibi no thenye nye yo?
Q20221127180629716141	CLT_16								n rünami ko nasü zü(traditional dance) za ju posüte?
Q20221127180629716586	CLT_17								n rünami ko dibi no ceyo thiyo?
Q20221127180629717102	CLT_18								n rünami ko füne do zü hi za jü posüte?
Q20221127180629717830	CLT_19								n rünami za kümüle marhe, lakho ko do zü ko, mefü, gale ko za posüte?
Q20221127180629718555	CLT_20								küra ko pü no didi thiyo n rüna mi ko?
Q20221127180629719014	CLT_21								n rüna mi za li(folk songs) kümüle ju posüte?
Q20221127180629719417	CLT_22								dipü bizü tsale thi zü mhanyo ko sü yo tsale thi küto la?
Q20221127180629719814	CLT_23								pethimi mhase (oral history) hi dibi no natsi khre ko zü küza no vori yo?
Q20221127180629720219	CLT_24								n rüna mi ko hi dibi no vori?
Q20221127180629720618	CLT_25								thazü thüju sepü posüte?
Q20221127180629721114	CLT_26								thazu nane ko za jü kropü posüte?
Q20221127180629721546	CLT_27								thazü mi ko dibi no fü tüyo?
Q20221127180629721994	CLT_28								thazü tü ce dipü bizü mhanyo ko sü no rühü yo?
Q20221127180629722485	CLT_29								thazü ma ko dibi no khünü mu müra küche thi no ma yo?
Q20221127180629722978	CLT_30								tsüdo ri rünami ko thura lo rühü yo me? Dipü bizü thüjo ba rühü küto la?
Q20221127180629723389	CLT_31								dipü bizü ornaments n rüna mi ko süyo?mu di pü no thi ?
